Ticker,Company,Sector,Market Cap
MSC,Studio City International Holdings Limited American depositary shares each representing four  Class A ordinary shares,Consumer Discretionary,977722774.0
MTA,Metalla Royalty & Streaming Ltd. Common Shares,Basic Materials,257143524.0
MWG,Multi Ways Holdings Limited Ordinary Shares,Consumer Discretionary,8635200.0
MYND,Mynd.ai Inc. American Depositary Shares,Real Estate,62309222.0
MYTE,MYT Netherlands Parent B.V. American Depositary Shares each representing one Ordinary Share,Consumer Discretionary,792120787.0
NCDL,Nuveen Churchill Direct Lending Corp. Common Stock,,933336923.0
NCL,Northann Corp. Common Stock,Industrials,10412413.0
NDMO,Nuveen Dynamic Municipal Opportunities Fund Common Shares of Beneficial Interest,Finance,616535546.0
NFGC,New Found Gold Corp Common Shares,Basic Materials,355920756.0
NMCO,Nuveen Municipal Credit Opportunities Fund Common Shares,Finance,592627349.0
NMG,Nouveau Monde Graphite Inc. Common Shares,Basic Materials,339542451.0
NRXS,Neuraxis Inc. Common Stock,Health Care,21775516.0
NXG,NXG NextGen Infrastructure Income Fund Common Shares of Beneficial Interest,,136824139.0
NYC,American Strategic Investment Co. Class A Common Stock,Real Estate,24375417.0
OBDC,Blue Owl Capital Corporation Common Stock,Finance,5806433484.0
ONON,On Holding AG Class A Ordinary Shares,Consumer Discretionary,37873614537.0
OPFI,OppFi Inc. Class A Common Stock,Finance,1089747804.0
ORLA,Orla Mining Ltd. Common Shares,Basic Materials,1947149731.0
OSTX,OS Therapies Incorporated Common Stock,Health Care,57131237.0
OWLT,Owlet Inc. Class A Common Stock,Industrials,72643465.0
OZ,Belpointe PREP LLC Class A Units,Real Estate,230446220.0
PAPL,Pineapple Financial Inc. Common Stock,Finance,4922802.0
PDCC,Pearl Diver Credit Company Inc. Common Stock,,0.0
PDPA,Pearl Diver Credit Company Inc. 8.00% Series A Preferred Stock Due 2029,,0.0
PDX,PIMCO Dynamic Income Strategy Fund Common Shares of Beneficial Interest,Finance,1215583330.0
PGZ,Principal Real Estate Income Fund Common Shares of Beneficial Interest,Finance,0.0
PHGE,BiomX Inc. COmmon Stock,Health Care,14904814.0
PNST,Pinstripes Holdings Inc. Class A Common Stock,Consumer Discretionary,15233358.0
PSBD,Palmer Square Capital BDC Inc. Common Stock,,0.0
PSF,Cohen & Steers Select Preferred and Income Fund Inc. Common Stock,Finance,987686423.0
PSFE,Paysafe Limited Common Shares,Consumer Discretionary,1120207890.0
PSQH,PSQ Holdings Inc. Class A Common Stock,Consumer Discretionary,145306088.0
QBTS,D-Wave Quantum Inc. Common Shares,Technology,1364250309.0
RFM,RiverNorth Flexible Municipal Income Fund Inc. Common Stock,Finance,93251606.0
RFMZ,RiverNorth Flexible Municipal Income Fund II Inc. Common Stock,Finance,337758856.0
RGT,Royce Global Trust Inc. Common Stock,Finance,69751076.0
RHE,Regional Health Properties Inc. Common Stock,Real Estate,5261897.0
RLTY,Cohen & Steers Real Estate Opportunities and Income Fund Common Shares of Beneficial Interest,Finance,0.0
RMI,RiverNorth Opportunistic Municipal Income Fund Inc. Common Stock,Finance,98530723.0
RMM,RiverNorth Managed Duration Municipal Income Fund Inc. Common Stock,Finance,293297315.0
RMMZ,RiverNorth Managed Duration Municipal Income Fund II Inc. Common Stock,Finance,303595479.0
ROLR,High Roller Technologies Inc. Common Stock,Consumer Discretionary,40178106.0
RSF,RiverNorth Capital and Income Fund Common Stock,Finance,50412033.0
RSKD,Riskified Ltd. Class A Ordinary Shares,Consumer Discretionary,937407035.0
RYDE,Ryde Group Ltd. Class A Ordinary Shares,Consumer Discretionary,9687259.0
SARO,StandardAero Inc. Common Stock,Industrials,8709380845.0
SATX,SatixFy Communications Ltd. Ordinary Share,Technology,104723883.0
SBEV,Splash Beverage Group Inc. (NV) Common Stock,Consumer Staples,12280492.0
SBXD,SilverBox Corp IV Class A Ordinary Shares,,0.0
SDHY,PGIM Short Duration High Yield Opportunities Fund Common Shares,Finance,408585807.0
SDRL,Seadrill Limited Common Shares,Energy,2500182500.0
SER,Serina Therapeutics Inc. Common Stock,Health Care,41792287.0
SGHC,Super Group (SGHC) Limited Ordinary Shares,Consumer Discretionary,3933716876.0
SGN,Signing Day Sports Inc. Common Stock,Technology,1095681.0
SHCO,Soho House & Co Inc. Class A Common Stock,Consumer Discretionary,1490387359.0
SII,Sprott Inc. Common Shares,Finance,1122247000.0
SKE,Skeena Resources Limited Common Shares,Basic Materials,1057963933.0
SLSR,Solaris Resources Inc. Common Shares,,561362140.0
SMWB,Similarweb Ltd. Ordinary Shares,Technology,1311110136.0
SOAR,Volato Group Inc. Class A Common Stock,Consumer Discretionary,6051418.0
SOS,SOS Limited American Depositary Shares one hundred and fifty (150) Class A Ordinary Shares,Finance,99852166.0
SPMA,Sound Point Meridian Capital Inc. 8.00% Series A Preferred Shares Due 2029,,0.0
SPMC,Sound Point Meridian Capital Inc. Common Stock,,0.0
SRFM,Surf Air Mobility Inc. Common Stock,Consumer Discretionary,71183515.0
STG,Sunlands Technology Group American Depositary Shares representing Class A ordinary shares,Real Estate,97425831.0
STRW,Strawberry Fields REIT Inc. Common Stock,Real Estate,83787368.0
STVN,Stevanato Group S.p.A. Ordinary Shares,Health Care,6365932375.0
SUPV,Grupo Supervielle S.A. American Depositary Shares each Representing five Class B shares,Finance,1522712215.0
SW,Smurfit WestRock plc Ordinary Shares,Consumer Discretionary,29155287501.0
SYNX,Silynxcom Ltd. Ordinary Shares,Consumer Staples,22417500.0
TBBB,BBB Foods Inc. Class A Common Shares,Consumer Staples,3458027177.0
TBN,Tamboran Resources Corporation Common stock,Energy,362576744.0
TEAF,Tortoise Sustainable and Social Impact Term Fund Common shares of beneficial interest,Finance,165671040.0
TFSA,Terra Income Fund 6 LLC 7.00% Notes due 2026,,210634669.0
TIXT,TELUS International (Cda) Inc. Subordinate Voting Shares,Technology,1086902483.0
TOPP,Toppoint Holdings Inc. Common Stock,Industrials,53375000.0
TPET,Trio Petroleum Corp. Common Stock,Energy,10626609.0
TPTA,Terra Property Trust Inc. 6.00% Notes due 2026,Real Estate,395487605.0
TSLX,Sixth Street Specialty Lending Inc. Common Stock,Finance,2056720367.0
TXO,TXO Partners L.P. Common Units Representing Limited Partner Interests,Energy,783490308.0
VENU,Venu Holding Corporation Common Stock,Consumer Discretionary,376511192.0
VG,Venture Global Inc.,,57589004448.0
VINE,Fresh Vine Wine Inc. Common Stock,Consumer Staples,13038199.0
VLN,Valens Semiconductor Ltd. Ordinary Shares,Technology,292691415.0
VLRS,Controladora Vuela Compania de Aviacion S.A.B. de C.V. American Depositary Shares each representing ten (10) Ordinary Participation Certificates,Consumer Discretionary,1041217175.0
VNCE,Vince Holding Corp. Common Stock,Consumer Discretionary,41233490.0
VTAK,Catheter Precision Inc. Common Stock,Health Care,3283500.0
VTMX,Corporacion Inmobiliaria Vesta S.A.B de C.V. American Depositary Shares each representing ten (10) Common Shares,Finance,2235981720.0
WFG,West Fraser Timber Co. Ltd Common stock,Basic Materials,7352124960.0
ZDGE,Zedge Inc. Class B Common Stock ,Technology,38470418.0
ZGN,Ermenegildo Zegna N.V. Ordinary Shares,Consumer Discretionary,2260301675.0
ZIM,ZIM Integrated Shipping Services Ltd. Ordinary Shares,Consumer Discretionary,2029235397.0
ZONE,CleanCore Solutions Inc. Class B Common Stock,Industrials,10057986.0
PRGO,Perrigo Company plc Ordinary Shares,Health Care,3371131037.0
PRGS,Progress Software Corporation Common Stock (DE),Technology,2298592563.0
PRH,Prudential Financial Inc. 5.950% Junior Subordinated Notes due 2062,Finance,9006800000.0
PRI,Primerica Inc. Common Stock,Finance,9684713994.0
PRIM,Primoris Services Corporation Common Stock,Industrials,4642421850.0
PRK,Park National Corporation Common Stock,Finance,2710346051.0
PRKS,United Parks & Resorts Inc. Common Stock,Health Care,2849731853.0
PRLB,Proto Labs Inc. Common stock,Industrials,1003687612.0
PRLD,Prelude Therapeutics Incorporated Common Stock,Health Care,66867732.0
PRMB,Primo Brands Corporation Class A Common Stock,,5248151296.0
PRME,Prime Medicine Inc. Common Stock,Health Care,413156652.0
PRO,PROS Holdings Inc. Common Stock,Technology,1146696592.0
PROK,ProKidney Corp. Class A Ordinary Shares,Health Care,501658554.0
PROP,Prairie Operating Co. Common Stock,Finance,213832059.0
PROV,Provident Financial Holdings Inc. Common Stock,Finance,106855384.0
PRPH,ProPhase Labs Inc. Common Stock (DE),Health Care,12891976.0
PRPL,Purple Innovation Inc. Common Stock,Consumer Discretionary,134637768.0
PRPO,Precipio Inc.  Common Stock,Industrials,9679634.0
PRS,Prudential Financial Inc. 5.625% Junior Subordinated Notes due 2058,Finance,8561800000.0
PRSO,Peraso Inc. Common Stock,Technology,3464259.0
PRSU,Pursuit Attractions and Hospitality Inc. Common Stock,Consumer Discretionary,821785877.0
PRT,PermRock Royalty Trust Trust Units,Energy,50974417.0
PRTA,Prothena Corporation plc Ordinary Shares,Health Care,840492394.0
PRTC,PureTech Health plc American Depositary Shares,Health Care,442929424.0
PRTH,Priority Technology Holdings Inc. Common Stock,Consumer Discretionary,702982014.0
PRTS,CarParts.com Inc. Common Stock,Consumer Discretionary,76341525.0
PRU,Prudential Financial Inc. Common Stock,Finance,41762360000.0
PRVA,Privia Health Group Inc. Common Stock,Health Care,2709630596.0
PSA,Public Storage Common Stock,Real Estate,51164996736.0
PSEC,Prospect Capital Corporation Common Stock,Finance,1910450806.0
PSIX,Power Solutions International Inc. Common Stock,Industrials,988983488.0
PSMT,PriceSmart Inc. Common Stock,Consumer Discretionary,2783834303.0
PSN,Parsons Corporation Common Stock,Technology,8897655827.0
PSNL,Personalis Inc. Common Stock,Health Care,432366274.0
PSTG,Pure Storage Inc. Class A Common Stock,Technology,23537997530.0
PSTL,Postal Realty Trust Inc. Class A Common Stock,Real Estate,304659198.0
PSTV,PLUS THERAPEUTICS Inc. Common Stock ,Health Care,7252490.0
PSX,Phillips 66 Common Stock,Energy,50326867202.0
PTA,Cohen & Steers Tax-Advantaged Preferred Securities and Income Fund Common Shares of Beneficial Interest,Finance,1086676165.0
PTC,PTC Inc. Common Stock,Technology,22699590957.0
PTCT,PTC Therapeutics Inc. Common Stock,Health Care,3582462892.0
PTEN,Patterson-UTI Energy Inc. Common Stock,Energy,3412118964.0
PTGX,Protagonist Therapeutics Inc. Common Stock,Health Care,2246249298.0
PTIX,Protagenic Therapeutics Inc. Common Stock,Health Care,3023695.0
PTLO,Portillo's Inc. Class A Common Stock,Consumer Discretionary,927035428.0
PTMN,Portman Ridge Finance Corporation Common Stock,Finance,153672490.0
PTN,Palatin Technologies Inc. Common Stock,Health Care,18666545.0
PTON,Peloton Interactive Inc. Class A Common Stock,Consumer Discretionary,3204257188.0
PTPI,Petros Pharmaceuticals Inc. Common Stock,Health Care,3284878.0
PTVE,Pactiv Evergreen Inc. Common stock,Consumer Discretionary,3186006046.0
PTY,Pimco Corporate & Income Opportunity Fund,Finance,0.0
PUBM,PubMatic Inc. Class A Common Stock,Technology,715068158.0
PULM,Pulmatrix Inc. Common Stock,Health Care,26588635.0
PUMP,ProPetro Holding Corp. Common Stock,Energy,1081791630.0
PVBC,Provident Bancorp Inc. (MD) Common Stock,Finance,202122490.0
PVH,PVH Corp. Common Stock,Consumer Discretionary,5023677779.0
PVL,Permianville Royalty Trust Trust Units ,Energy,49830000.0
PVLA,Palvella Therapeutics Inc. Common Stock,Health Care,16489798.0
PW,Power REIT (MD) Common Stock,Real Estate,4101490.0
PWOD,Penns Woods Bancorp Inc. Common Stock,Finance,233805016.0
PWP,Perella Weinberg Partners Class A Common Stock,Finance,2298421845.0
PWR,Quanta Services Inc. Common Stock,Industrials,52849379358.0
PWUP,PowerUp Acquisition Corp. Class A Ordinary Shares,Finance,0.0
PWUPU,PowerUp Acquisition Corp. Unit,Finance,0.0
PWUPW,PowerUp Acquisition Corp. Warrant,Finance,0.0
PX,P10 Inc. Class A Common Stock,Finance,1537045336.0
PXLW,Pixelworks Inc.  Common Stock,Technology,51871693.0
PYCR,Paycor HCM Inc. Common Stock,Technology,3992018914.0
PYN,PIMCO New York Municipal Income Fund III Common Shares of Beneficial Interest,Finance,0.0
PYPL,PayPal Holdings Inc. Common Stock,Consumer Discretionary,89336234963.0
PYT,PPlus Tr GSC-2 Tr Ctf Fltg Rate,Finance,0.0
PYXS,Pyxis Oncology Inc. Common Stock,Health Care,95145166.0
PZC,PIMCO California Municipal Income Fund III Common Shares of Beneficial Interest,Finance,0.0
PZG,Paramount Gold Nevada Corp. Common Stock,Basic Materials,26450069.0
PZZA,Papa John's International Inc. Common Stock,Consumer Discretionary,1272044048.0
QCOM,QUALCOMM Incorporated Common Stock,Technology,191000000000.0
QCRH,QCR Holdings Inc. Common Stock,Finance,1328428316.0
QDEL,QuidelOrtho Corporation Common Stock,Health Care,2975437160.0
QETA,Quetta Acquisition Corporation Common Stock,Finance,0.0
QETAR,Quetta Acquisition Corporation Right,Finance,0.0
QETAU,Quetta Acquisition Corporation Unit,Finance,0.0
QIPT,Quipt Home Medical Corp. Common Shares,Health Care,128842906.0
QLGN,Qualigen Therapeutics Inc. Common Stock,Health Care,3129832.0
QLYS,Qualys Inc. Common Stock,Technology,5237557299.0
QMCO,Quantum Corporation Common Stock,Technology,157915059.0
QNCX,Quince Therapeutics Inc. Common Stock,Health Care,69962612.0
QNST,QuinStreet Inc. Common Stock,Consumer Discretionary,1214717522.0
QQQX,Nuveen NASDAQ 100 Dynamic Overwrite Fund Shares of Beneficial Interest,Finance,0.0
QRHC,Quest Resource Holding Corporation Common Stock,Utilities,118996762.0
QRTEA,Qurate Retail Inc. Series A Common Stock,Consumer Discretionary,152825759.0
QRTEB,Qurate Retail Inc. Series B Common Stock,Consumer Discretionary,869320553.0
QRTEP,Qurate Retail Inc. 8.0% Fixed Rate Cumulative Redeemable Preferred Stock,Consumer Discretionary,14536309879.0
QRVO,Qorvo Inc. Common Stock,Technology,8407204520.0
QS,QuantumScape Corporation Class A Common Stock,Miscellaneous,2644351516.0
QSI,Quantum-Si Incorporated Class A Common Stock,Industrials,328239560.0
QSIAW,Quantum-Si Incorporated Warrant,Industrials,138431466.0
QTI,QT Imaging Holdings Inc. Common Stock,Health Care,11172461.0
QTRX,Quanterix Corporation Common Stock,Industrials,368677800.0
QTTB,Q32 Bio Inc. Common Stock,Health Care,42876068.0
QTWO,Q2 Holdings Inc. Common Stock,Technology,5686154659.0
QUAD,Quad Graphics Inc Class A Common Stock,Consumer Discretionary,354929757.0
QUBT,Quantum Computing Inc. Common Stock,Technology,1083015183.0
QUIK,QuickLogic Corporation Common Stock,Technology,135010921.0
QVCC,QVC Inc. 6.250% Senior Secured Notes due 2068,Consumer Discretionary,12.0
QVCD,QVC Inc. 6.375% Senior Secured Notes due 2067,Consumer Discretionary,12.0
QXO,QXO Inc. Common Stock,Technology,5621476577.0
R,Ryder System Inc. Common Stock,Consumer Discretionary,6933480421.0
RA,Brookfield Real Assets Income Fund Inc. Common Stock,Finance,0.0
RAIL,FreightCar America Inc. Common Stock,Industrials,248455732.0
RAIN,Rain Enhancement Technologies Holdco Inc. Class A Common Stock,Technology,25809676.0
RAINW,Rain Enhancement Technologies Holdco Inc. Warrants,Technology,861427.0
RAMP,LiveRamp Holdings Inc. Common Stock,Technology,2190270244.0
RAND,Rand Capital Corporation Common Stock,Finance,58692418.0
RANG,Range Capital Acquisition Corp. Ordinary Shares,,0.0
RANGR,Range Capital Acquisition Corp. Rights,,0.0
RANGU,Range Capital Acquisition Corp. Units,,0.0
RANI,Rani Therapeutics Holdings Inc. Class A Common Stock,Health Care,85933023.0
RAPP,Rapport Therapeutics Inc. Common Stock,Health Care,508412752.0
RAPT,RAPT Therapeutics Inc. Common Stock,Health Care,41250739.0
RARE,Ultragenyx Pharmaceutical Inc. Common Stock,Health Care,4067765005.0
RAVE,Rave Restaurant Group Inc. Common Stock,Consumer Discretionary,38102956.0
RBB,RBB Bancorp Common Stock,Finance,345906283.0
RBBN,Ribbon Communications Inc. Common Stock,Technology,720826954.0
RBC,RBC Bearings Incorporated Common Stock,Industrials,9869763193.0
RBCAA,Republic Bancorp Inc. Class A Common Stock,Finance,1302676688.0
RBKB,Rhinebeck Bancorp Inc. Common Stock,Finance,110432566.0
RBLX,Roblox Corporation Class A Common Stock,Technology,44012961923.0
RBRK,Rubrik Inc. Class A Common Stock,Technology,13150452535.0
RC,Ready Capital Corporation Common Stock,Real Estate,1147694094.0
RCAT,Red Cat Holdings Inc. Common Stock,Technology,691787549.0
RCB,Ready Capital Corporation 6.20% Senior Notes due 2026,Real Estate,4068331195.0
RCC,Ready Capital Corporation 5.75% Senior Notes due 2026,Real Estate,4120575713.0
RCD,Ready Capital Corporation 9.00% Senior Notes due 2029,Real Estate,0.0
RCEL,Avita Medical Inc. Common Stock,Health Care,244348302.0
RCG,RENN Fund Inc Common Stock,Finance,0.0
RCKT,Rocket Pharmaceuticals Inc. Common Stock,Health Care,976292380.0
RCKTW,Rocket Pharmaceuticals Inc. Warrant,Health Care,6380996.0
RCKY,Rocky Brands Inc. Common Stock,Consumer Discretionary,190444948.0
RCL,Royal Caribbean Cruises Ltd. Common Stock,Consumer Discretionary,62405943204.0
RCMT,RCM Technologies Inc. Common Stock,Consumer Discretionary,145179205.0
RCS,PIMCO Strategic Income Fund Inc.,Finance,0.0
RCUS,Arcus Biosciences Inc. Common Stock,Health Care,1204292774.0
RDDT,Reddit Inc. Class A Common Stock,Technology,32025475536.0
RDFN,Redfin Corporation Common Stock,Finance,979445745.0
RDI,Reading International Inc Class A Common Stock,Consumer Discretionary,39694346.0
RDIB,Reading International Inc Class B Common Stock,Consumer Discretionary,148380604.0
RDN,Radian Group Inc. Common Stock,Finance,4971369053.0
RDNT,RadNet Inc. Common Stock,Health Care,4743633307.0
RDUS,Radius Recycling Inc. Class A Common Stock,Consumer Discretionary,351660746.0
RDVT,Red Violet Inc. Common Stock ,Technology,490982811.0
RDW,Redwire Corporation Common Stock,Industrials,1413328100.0
RDZN,Roadzen Inc. Ordinary Shares,Finance,113269572.0
RDZNW,Roadzen Inc. Warrants,Finance,5885911.0
REAL,The RealReal Inc. Common Stock,Consumer Discretionary,1038775626.0
REBN,Reborn Coffee Inc. Common Stock,Consumer Discretionary,5545572.0
REFI,Chicago Atlantic Real Estate Finance Inc. Common Stock,Real Estate,298640471.0
REFR,Research Frontiers Incorporated Common Stock,Miscellaneous,53628459.0
REG,Regency Centers Corporation Common Stock,Real Estate,13026642271.0
REGCO,Regency Centers Corporation 5.875% Series B Cumulative Redeemable Preferred Stock,Real Estate,4091131626.0
REGCP,Regency Centers Corporation 6.25% Series A Cumulative Redeemable Preferred Stock,Real Estate,4337978964.0
REGN,Regeneron Pharmaceuticals Inc. Common Stock,Health Care,74262246154.0
REI,Ring Energy Inc. Common Stock,Energy,275492487.0
REKR,Rekor Systems Inc. Common Stock,Telecommunications,176391609.0
RELI,Reliance Global Group Inc. Common Stock,Finance,3767661.0
RELIW,Reliance Global Group Inc. Series A Warrants,Finance,43328.0
RELL,Richardson Electronics Ltd. Common Stock,Technology,189040937.0
RELY,Remitly Global Inc. Common Stock,Consumer Discretionary,4559367926.0
RENB,Renovaro Inc. Common Stock,Health Care,141353665.0
RENE,Cartesian Growth Corporation II Class A Ordinary Shares,Finance,0.0
RENEU,Cartesian Growth Corporation II Unit,Finance,0.0
RENEW,Cartesian Growth Corporation II Warrant,Finance,0.0
RENT,Rent the Runway Inc. Class A Common Stock,Consumer Discretionary,32998828.0
REPL,Replimune Group Inc. Common Stock,Health Care,929793064.0
REPX,Riley Exploration Permian Inc. Common Stock,Energy,741588534.0
RES,RPC Inc. Common Stock,Energy,1455362816.0
REVB,Revelation Biosciences Inc. Common Stock,Health Care,1054227.0
REVBW,Revelation Biosciences Inc. Warrant,Health Care,55802.0
REVG,REV Group Inc. Common Stock,Consumer Discretionary,1812615732.0
REX,REX American Resources Corporation,Industrials,720955918.0
REXR,Rexford Industrial Realty Inc. Common Stock,Real Estate,9091373718.0
REYN,Reynolds Consumer Products Inc. Common Stock,Consumer Discretionary,5779013818.0
REZI,Resideo Technologies Inc. Common Stock ,Industrials,3403861075.0
RF,Regions Financial Corporation Common Stock,Finance,22239896330.0
RFI,Cohen & Steers Total Return Realty Fund Inc. Common Stock,Finance,583275514.0
RFIL,RF Industries Ltd. Common Stock,Technology,46290052.0
RFL,Rafael Holdings Inc. Class B Common Stock,Finance,51815715.0
RGA,Reinsurance Group of America Incorporated Common Stock,Finance,14808935957.0
RGCO,RGC Resources Inc. Common Stock,Utilities,213884900.0
RGEN,Repligen Corporation Common Stock,Health Care,9294273410.0
RGLD,Royal Gold Inc. Common Stock,Industrials,9169133072.0
RGLS,Regulus Therapeutics Inc. Common Stock,Health Care,81220166.0
RGNX,REGENXBIO Inc. Common Stock,Health Care,390415159.0
RGP,Resources Connection Inc. Common Stock,Consumer Discretionary,285245342.0
RGR,Sturm Ruger & Company Inc. Common Stock,Industrials,606316655.0
RGS,Regis Corporation Common Stock,Consumer Discretionary,56512100.0
RGTI,Rigetti Computing Inc. Common Stock,Technology,2538304679.0
RGTIW,Rigetti Computing Inc. Warrants,Technology,1036474411.0
RH,RH Common Stock,Consumer Discretionary,7789756572.0
RHI,Robert Half Inc. Common Stock,Consumer Discretionary,7215171774.0
RHP,Ryman Hospitality Properties Inc. (REIT),Real Estate,6209355179.0
RICK,RCI Hospitality Holdings Inc. Common Stock,Consumer Discretionary,508457000.0
RIGL,Rigel Pharmaceuticals Inc. Common Stock,Health Care,390525437.0
RILY,B. Riley Financial Inc. Common Stock,Finance,142434678.0
RILYG,B. Riley Financial Inc. 5.00% Senior Notes due 2026,Finance,362949179.0
RILYK,B. Riley Financial Inc. 5.50% Senior Notes Due 2026,Finance,646903537.0
RILYL,B. Riley Financial Inc. Depositary Shares each representing 1/1000th in a share of 7.375% Series B Cumulative Perpetual Preferred Stock par value $0.0001,Finance,163174631.0
RILYM,B. Riley Financial Inc. 6.375% Senior Notes due 2025,Finance,760668279.0
RILYN,B. Riley Financial Inc. 6.50% Senior Notes Due 2026,Finance,371184160.0
RILYP,B. Riley Financial Inc. Depositary Shares each representing a 1/1000th fractional interest in a share of Series A Cumulative Perpetual Preferred Stock,Finance,160124638.0
RILYT,B. Riley Financial Inc. 6.00% Senior Notes Due 2028,Finance,307439304.0
RILYZ,B. Riley Financial Inc. 5.25% Senior Notes due 2028,Finance,272974382.0
RIME,Algorhythm Holdings Inc. Common Stock,Consumer Staples,537334.0
RIOT,Riot Platforms Inc. Common Stock ,Finance,4499687744.0
RITM,Rithm Capital Corp. Common Stock,Real Estate,5872976369.0
RIV,RiverNorth Opportunities Fund Inc. Common Stock,Finance,0.0
RIVN,Rivian Automotive Inc. Class A Common Stock,Consumer Discretionary,13033961838.0
RJF,Raymond James Financial Inc. Common Stock,Finance,35226300487.0
RKDA,Arcadia Biosciences Inc. Common Stock,Consumer Staples,6988356.0
RKLB,Rocket Lab USA Inc. Common Stock,Industrials,15177300328.0
RKT,Rocket Companies Inc. Class A Common Stock,Finance,23976470910.0
RL,Ralph Lauren Corporation Common Stock,Consumer Discretionary,15897176064.0
RLAY,Relay Therapeutics Inc. Common Stock,Health Care,811807346.0
RLGT,Radiant Logistics Inc. Common Stock,Consumer Discretionary,330284522.0
RLI,RLI Corp. Common Stock (DE),Finance,6642279711.0
RLJ,RLJ Lodging Trust Common Shares of Beneficial Interest $0.01 par value,Real Estate,1499351135.0
RLMD,Relmada Therapeutics Inc. Common Stock,Health Care,11743799.0
RLYB,Rallybio Corporation Common Stock,Health Care,36509076.0
RM,Regional Management Corp. Common Stock,Finance,369229492.0
RMAX,RE/MAX Holdings Inc. Class A Common Stock,Finance,192494941.0
RMBI,Richmond Mutual Bancorporation Inc. Common Stock,Finance,149774941.0
RMBL,RumbleOn Inc. Class B Common Stock,Technology,169426870.0
RMBS,Rambus Inc. Common Stock,Technology,6711055268.0
RMCF,Rocky Mountain Chocolate Factory Inc. Common Stock,Consumer Staples,15451477.0
RMCO,Royalty Management Holding Corporation Class A Common Stock,Miscellaneous,15978222.0
RMCOW,Royalty Management Holding Corporation Warrant,Miscellaneous,431561.0
RMD,ResMed Inc. Common Stock,Health Care,36773802330.0
RMNI,Rimini Street Inc. (DE) Common Stock,Consumer Discretionary,271850800.0
RMR,The RMR Group Inc. Class A Common Stock,Consumer Discretionary,619396939.0
RMSG,Real Messenger Corporation Ordinary Shares,Technology,19667939.0
RMSGW,Real Messenger Corporation Warrants,Technology,481911.0
RMT,Royce Micro-Cap Trust Inc. Common Stock,Finance,472407582.0
RMTI,Rockwell Medical Inc. Common Stock,Health Care,71101373.0
RNA,Avidity Biosciences Inc. Common Stock,Health Care,3539907435.0
RNAC,Cartesian Therapeutics Inc. Common Stock,Health Care,487966042.0
RNAZ,TransCode Therapeutics Inc. Common Stock,Health Care,4901480.0
RNG,RingCentral Inc. Class A Common Stock,Technology,3133419562.0
RNGR,Ranger Energy Services Inc. Class A Common Stock,Energy,393295348.0
RNP,Cohen & Steers REIT and Preferred and Income Fund Inc. Common Shares,Finance,1052058025.0
RNST,Renasant Corporation Common Stock,Finance,2324597283.0
RNTX,Rein Therapeutics Inc. Common Stock,Health Care,47665070.0
RNXT,RenovoRx Inc. Common Stock,Health Care,33121848.0
ROAD,Construction Partners Inc. Class A Common Stock,Industrials,4719396758.0
ROCK,Gibraltar Industries Inc. Common Stock,Industrials,1890858661.0
ROG,Rogers Corporation Common Stock,Industrials,1863443222.0
ROIC,Retail Opportunity Investments Corp. Common Stock (MD),Real Estate,2243636293.0
ROK,Rockwell Automation Inc. Common Stock,Industrials,32562826620.0
ROKU,Roku Inc. Class A Common Stock,Telecommunications,11803245163.0
ROL,Rollins Inc. Common Stock,Finance,23425833624.0
ROOT,Root Inc. Class A Common Stock,Finance,1258132000.0
ROP,Roper Technologies Inc. Common Stock,Industrials,56978353967.0
ROST,Ross Stores Inc. Common Stock,Consumer Discretionary,49251830528.0
RPAY,Repay Holdings Corporation Class A Common Stock,Consumer Discretionary,685607936.0
RPD,Rapid7 Inc. Common Stock,Technology,2458736818.0
RPID,Rapid Micro Biosystems Inc. Class A Common Stock,Industrials,58311369.0
RPM,RPM International Inc. Common Stock,Consumer Discretionary,16257459006.0
RPRX,Royalty Pharma plc Class A Ordinary Shares ,Health Care,18300017240.0
RPT,Rithm Property Trust Inc. Common stock,Real Estate,127178106.0
RQI,Cohen & Steers Quality Income Realty Fund Inc Common Shares,Finance,1721731231.0
RR,Richtech Robotics Inc. Class B Common Stock,Industrials,370892928.0
