Ticker,Company,Sector,Market Cap
BYRN,Byrna Technologies Inc. Common Stock,Miscellaneous,692389113.0
BYSI,BeyondSpring Inc. Ordinary Shares,Health Care,66739869.0
BZAI,Blaize Holdings Inc. Common Stock,,0.0
BZAIW,Blaize Holdings Inc. Warrants,,0.0
BZFD,BuzzFeed Inc. Class A Common Stock,Consumer Discretionary,102222693.0
BZFDW,BuzzFeed Inc. Warrant,Consumer Discretionary,4750125.0
BZH,Beazer Homes USA Inc. Common Stock,Consumer Discretionary,854502247.0
C,Citigroup Inc. Common Stock,Finance,154000000000.0
CABA,Cabaletta Bio Inc. Common Stock,Health Care,122192910.0
CABO,Cable One Inc. Common Stock,Telecommunications,1880811540.0
CAC,Camden National Corporation Common Stock,Finance,638482148.0
CACC,Credit Acceptance Corporation Common Stock,Finance,6341312991.0
CACI,CACI International Inc. Class A Common Stock,Technology,9107121949.0
CADE,Cadence Bank Common Stock,Finance,6422780394.0
CADL,Candel Therapeutics Inc. Common Stock,Health Care,223756450.0
CAF,Morgan Stanley China A Share Fund Inc. Common Stock,Finance,0.0
CAG,ConAgra Brands Inc. Common Stock,Consumer Staples,12305321510.0
CAH,Cardinal Health Inc. Common Stock,Health Care,31178213101.0
CAKE,Cheesecake Factory Incorporated (The) Common Stock,Consumer Discretionary,2627014800.0
CAL,Caleres Inc. Common Stock,Consumer Discretionary,673926322.0
CALC,CalciMedica Inc. Common Stock,Health Care,36805633.0
CALM,Cal-Maine Foods Inc. Common Stock,Consumer Staples,5232043783.0
CALX,Calix Inc Common Stock,Consumer Discretionary,2591627912.0
CAMP,CAMP4 Therapeutics Corporation Common Stock,,0.0
CAPL,CrossAmerica Partners LP Common Units representing limited partner interests,Energy,848821609.0
CAPN,Cayson Acquisition Corp Ordinary shares,,0.0
CAPNU,Cayson Acquisition Corp Unit,,0.0
CAPR,Capricor Therapeutics Inc. Common Stock,Health Care,672954638.0
CAR,Avis Budget Group Inc. Common Stock,Consumer Discretionary,3163230604.0
CARA,Cara Therapeutics Inc. Common Stock,Health Care,27382045.0
CARE,Carter Bankshares Inc. Common Stock,Finance,410451129.0
CARG,CarGurus Inc. Class A Common Stock ,Technology,4037353764.0
CARM,Carisma Therapeutics Inc. Common Stock,Health Care,19873052.0
CARR,Carrier Global Corporation Common Stock ,Industrials,62913582553.0
CARS,Cars.com Inc. Common Stock ,Technology,1138763812.0
CART,Maplebear Inc. Common Stock,Consumer Discretionary,11814590748.0
CARV,Carver Bancorp Inc. Common Stock,Finance,9402410.0
CASH,Pathward Financial Inc. Common Stock,Finance,1924013153.0
CASI,CASI Pharmaceuticals Inc. Ordinary Shares,Health Care,41124816.0
CASK,Heritage Distilling Holding Company Inc. Common Stock,Consumer Staples,5104971.0
CASS,Cass Information Systems Inc Common Stock,Consumer Discretionary,557695970.0
CASY,Casey's General Stores Inc. Common Stock,Consumer Discretionary,15264594083.0
CAT,Caterpillar Inc. Common Stock,Industrials,197000000000.0
CATO,Cato Corporation (The) Class A Common Stock,Consumer Discretionary,73935994.0
CATX,Perspective Therapeutics Inc. Common Stock,Health Care,271026035.0
CATY,Cathay General Bancorp Common Stock,Finance,3332807964.0
CAVA,CAVA Group Inc. Common Stock,Consumer Discretionary,14308714684.0
CBAN,Colony Bankcorp Inc. Common Stock,Finance,295679748.0
CBFV,CB Financial Services Inc. Common Stock,Finance,151146820.0
CBL,CBL & Associates Properties Inc. Common Stock,Real Estate,868051949.0
CBLL,CeriBell Inc. Common Stock,Health Care,822524642.0
CBNK,Capital Bancorp Inc. Common Stock,Finance,479509254.0
CBRE,CBRE Group Inc Common Stock Class A,Finance,43188318082.0
CBRL,Cracker Barrel Old Country Store Inc Common Stock,Consumer Discretionary,1337998588.0
CBSH,Commerce Bancshares Inc. Common Stock,Finance,8886168192.0
CBT,Cabot Corporation Common Stock,Industrials,4803554275.0
CBU,Community Financial System Inc. Common Stock,Finance,3450580084.0
CBUS,Cibus Inc. Class A Common Stock,Industrials,71554797.0
CBZ,CBIZ Inc. Common Stock,Consumer Discretionary,4213273449.0
CC,Chemours Company (The) Common Stock,Industrials,2938904653.0
CCAP,Crescent Capital BDC Inc. Common stock,Finance,722329551.0
CCB,Coastal Financial Corporation Common Stock,Finance,1142878835.0
CCBG,Capital City Bank Group Common Stock,Finance,616439709.0
CCCC,C4 Therapeutics Inc. Common Stock,Health Care,256237921.0
CCCS,CCC Intelligent Solutions Holdings Inc. Common Stock,Technology,7105706514.0
CCD,Calamos Dynamic Convertible & Income Fund Common Stock,Finance,0.0
CCEL,Cryo-Cell International Inc. Common Stock,Health Care,61272408.0
CCI,Crown Castle Inc. Common Stock,Real Estate,38457595426.0
CCIR,Cohen Circle Acquisition Corp. I Class A Ordinary Shares,,0.0
CCIRU,Cohen Circle Acquisition Corp. I Unit,Finance,0.0
CCIRW,Cohen Circle Acquisition Corp. I Warrant,,0.0
CCIX,Churchill Capital Corp IX Ordinary Shares,,0.0
CCIXW,Churchill Capital Corp IX Warrant,,0.0
CCK,Crown Holdings Inc.,Industrials,10522856228.0
CCL,Carnival Corporation Common Stock,Consumer Discretionary,3680998643.0
CCLD,CareCloud Inc. Common Stock,Technology,56189628.0
CCLDO,CareCloud Inc. 8.75% Series B Cumulative Redeemable Perpetual Preferred Stock,Technology,356230876.0
CCLDP,CareCloud Inc. 8.75% Series A Cumulative Redeemable Perpetual Preferred Stock,Technology,355651116.0
CCNE,CNB Financial Corporation Common Stock,Finance,530091380.0
CCNEP,CNB Financial Corporation Depositary Shares each representing a 1/40th ownership interest in a share of 7.125% Series A Fixed-Rate Non-Cumulative Perpetual Preferred Stock,Finance,518591021.0
CCO,Clear Channel Outdoor Holdings Inc. Common Stock,Consumer Discretionary,699382148.0
CCOI,Cogent Communications Holdings Inc.,Consumer Discretionary,3711139813.0
CCRD,CoreCard Corporation Common Stock,Technology,174299325.0
CCRN,Cross Country Healthcare Inc. Common Stock $0.0001 Par Value,Consumer Discretionary,599082975.0
CCS,Century Communities Inc. Common Stock,Consumer Discretionary,2404179397.0
CCSI,Consensus Cloud Solutions Inc. Common Stock,Technology,508842843.0
CCZ,Comcast Holdings ZONES,Telecommunications,245000000000.0
CDE,Coeur Mining Inc. Common Stock,Basic Materials,2527192922.0
CDIO,Cardio Diagnostics Holdings Inc. Common stock,Health Care,18578049.0
CDIOW,Cardio Diagnostics Holdings Inc. Warrant,Health Care,2891446.0
CDLX,Cardlytics Inc. Common Stock,Technology,197191079.0
CDMO,Avid Bioservices Inc. Common Stock,Health Care,794424211.0
CDNA,CareDx Inc. Common Stock,Health Care,1198180678.0
CDNS,Cadence Design Systems Inc. Common Stock,Technology,87895806240.0
CDP,COPT Defense Properties Common Shares of Beneficial Interest,Real Estate,3360511403.0
CDRE,Cadre Holdings Inc. Common Stock,Health Care,1604015526.0
CDT,Conduit Pharmaceuticals Inc. Common Stock,Health Care,4648728.0
CDTTW,Conduit Pharmaceuticals Inc. Warrant,Health Care,1594144.0
CDTX,Cidara Therapeutics Inc. Common Stock,Health Care,206854731.0
CDW,CDW Corporation Common Stock,Consumer Discretionary,26003816418.0
CDXC,ChromaDex Corporation Common Stock,Health Care,454480439.0
CDXS,Codexis Inc. Common Stock,Industrials,399565268.0
CDZI,CADIZ Inc. Common Stock,Utilities,340959921.0
CDZIP,Cadiz Inc. Depositary Shares,Utilities,1355569431.0
CE,Celanese Corporation Common Stock,Industrials,8090197476.0
CEAD,CEA Industries Inc. Common Stock,Industrials,5917061.0
CEADW,CEA Industries Inc. Warrant,Industrials,10528.0
CECO,CECO Environmental Corp. Common Stock,Industrials,1033629982.0
CEE,The Central and Eastern Europe Fund Inc. (The) Common Stock,Finance,0.0
CEG,Constellation Energy Corporation Common Stock ,Utilities,109000000000.0
CELC,Celcuity Inc. Common Stock,Health Care,424019530.0
CELH,Celsius Holdings Inc. Common Stock,Consumer Staples,6056760518.0
CELU,Celularity Inc. Class A Common Stock,Health Care,56210598.0
CELUW,Celularity Inc. Warrant,Health Care,1798739.0
CELZ,Creative Medical Technology Holdings Inc. Common Stock,Finance,4248680.0
CENT,Central Garden & Pet Company Common Stock,Consumer Discretionary,2393535022.0
CENTA,Central Garden & Pet Company Class A Common Stock Nonvoting,Consumer Discretionary,2030798692.0
CENX,Century Aluminum Company Common Stock,Industrials,1822569296.0
CEP,Cantor Equity Partners Inc. Class A Ordinary Shares,Finance,298858290.0
CEPO,Cantor Equity Partners I Inc. Class A Ordinary Shares,Finance,0.0
CERO,CERo Therapeutics Holdings Inc. Common Stock,Health Care,6448000.0
CEROW,CERo Therapeutics Holdings Inc. Warrants,Health Care,50700.0
CERS,Cerus Corporation Common Stock,Technology,365859368.0
CERT,Certara Inc. Common Stock,Technology,2134526020.0
CET,Central Securities Corporation Common Stock,Finance,11462313472.0
CETX,Cemtrex Inc. Common Stock,Technology,4758687.0
CETY,Clean Energy Technologies Inc. Common Stock,Consumer Discretionary,23849128.0
CEV,Eaton Vance California Municipal Income Trust Shares of Beneficial Interest,Finance,70653668.0
CEVA,CEVA Inc. Common Stock,Technology,793386164.0
CF,CF Industries Holdings Inc. Common Stock,Industrials,15331155745.0
CFB,CrossFirst Bankshares Inc. Common Stock,Finance,748877405.0
CFBK,CF Bankshares Inc. Common Stock,Finance,153150308.0
CFFI,C&F Financial Corporation Common Stock,Finance,235777398.0
CFFN,Capitol Federal Financial Inc. Common Stock,Finance,750175162.0
CFG,Citizens Financial Group Inc. Common Stock,Finance,20915647296.0
CFLT,Confluent Inc. Class A Common Stock,Technology,9426573455.0
CFR,Cullen/Frost Bankers Inc. Common Stock,Finance,8935492332.0
CFSB,CFSB Bancorp Inc. Common Stock,Finance,51004354.0
CG,The Carlyle Group Inc. Common Stock,Finance,20327026063.0
CGABL,The Carlyle Group Inc. 4.625% Subordinated Notes due 2061,Finance,6724407707.0
CGBD,Carlyle Secured Lending Inc. Common Stock,Finance,932093657.0
CGBDL,Carlyle Secured Lending Inc. 8.20% Notes due 2028,,1314941124.0
CGEM,Cullinan Therapeutics Inc. Common Stock,Health Care,614301106.0
CGNX,Cognex Corporation Common Stock,Industrials,6954944563.0
CGO,Calamos Global Total Return Fund Common Stock,Finance,0.0
CGON,CG Oncology Inc. Common stock,,2082317693.0
CGTX,Cognition Therapeutics Inc. Common Stock,Health Care,31323033.0
CHAR,Charlton Aria Acquisition Corporation Class A Ordinary Shares,,0.0
CHCI,Comstock Holding Companies Inc. Class A Common Stock,Finance,81782262.0
CHCO,City Holding Company Common Stock,Finance,1703094160.0
CHCT,Community Healthcare Trust Incorporated Common Stock,Real Estate,567671637.0
CHD,Church & Dwight Company Inc. Common Stock,Consumer Discretionary,26030988094.0
CHDN,Churchill Downs Incorporated Common Stock,Consumer Discretionary,9188562560.0
CHE,Chemed Corp,Health Care,8254966979.0
CHEF,The Chefs' Warehouse Inc. Common Stock,Consumer Discretionary,2124077241.0
CHGG,Chegg Inc. Common Stock,Real Estate,153331771.0
CHH,Choice Hotels International Inc. Common Stock,Consumer Discretionary,6845654427.0
CHI,Calamos Convertible Opportunities and Income Fund Common Stock,Finance,0.0
CHMG,Chemung Financial Corp Common Stock,Finance,221558880.0
CHN,China Fund Inc. (The) Common Stock,Finance,0.0
CHPT,ChargePoint Holdings Inc. Common Stock,Consumer Discretionary,442340874.0
CHRD,Chord Energy Corporation Common Stock,Energy,7180385476.0
CHRS,Coherus BioSciences Inc. Common Stock,Health Care,142864625.0
CHRW,C.H. Robinson Worldwide Inc. Common Stock,Consumer Discretionary,12785074324.0
CHSCL,CHS Inc Class B Cumulative Redeemable Preferred Stock Series 4,Industrials,319072078.0
CHSCM,CHS Inc Class B Reset Rate Cumulative Redeemable Preferred Stock Series 3,Industrials,309254476.0
CHSCN,CHS Inc Preferred Class B Series 2 Reset Rate,Industrials,316863117.0
CHSCO,CHS Inc. Class B Cumulative Redeemable Preferred Stock,Industrials,328398800.0
CHSCP,CHS Inc. 8%  Cumulative Redeemable Preferred Stock,Industrials,353924567.0
CHTR,Charter Communications Inc. Class A Common Stock New,Telecommunications,52268314153.0
CHW,Calamos Global Dynamic Income Fund Common Stock,Finance,0.0
CHWY,Chewy Inc. Class A Common Stock,Consumer Discretionary,16031794188.0
CHX,ChampionX Corporation Common Stock ,Industrials,5724525000.0
CHY,Calamos Convertible and High Income Fund Common Stock,Finance,0.0
CI,The Cigna Group Common Stock,Health Care,81676731226.0
CIA,Citizens Inc. Class A Common Stock ($1.00 Par),Finance,234061837.0
CICB,CION Investment Corporation 7.50% Notes due 2029,Finance,0.0
CIEN,Ciena Corporation Common Stock,Utilities,13731208789.0
CIF,MFS Intermediate High Income Fund Common Stock,Finance,0.0
CIFR,Cipher Mining Inc. Common Stock,Finance,2052056126.0
CIFRW,Cipher Mining Inc. Warrant,Finance,573532297.0
CII,BlackRock Enhanced Large Cap Core Fund Inc. Common Stock,Finance,3135912889.0
CIK,Credit Suisse Asset Management Income Fund Inc. Common Stock,Finance,0.0
CIM,Chimera Investment Corporation Common Stock,Real Estate,1158134812.0
CIMN,Chimera Investment Corporation 9.000% Senior Notes due 2029,Real Estate,2050311520.0
CIMO,Chimera Investment Corporation 9.250% Senior Notes due 2029,Real Estate,0.0
CINF,Cincinnati Financial Corporation Common Stock,Finance,21452684598.0
CING,Cingulate Inc. Common Stock,Health Care,16318144.0
CINGW,Cingulate Inc. Warrants,Health Care,188237.0
CION,CION Investment Corporation Common Stock,Finance,611722626.0
CISO,CISO Global Inc. Common Stock,Consumer Discretionary,12058303.0
CIVB,Civista Bancshares Inc. Common Stock,Finance,334086489.0
CIVI,Civitas Resources Inc. Common Stock,Energy,4938624706.0
CIX,CompX International Inc. Common Stock,Consumer Discretionary,308087111.0
CKPT,Checkpoint Therapeutics Inc. Common Stock,Health Care,146497500.0
CKX,CKX Lands Inc. Common Stock,Energy,24223032.0
CL,Colgate-Palmolive Company Common Stock,Consumer Discretionary,71798922901.0
CLAR,Clarus Corporation Common Stock,Consumer Discretionary,183371134.0
CLBK,Columbia Financial Inc. Common Stock,Finance,1614835661.0
CLDT,Chatham Lodging Trust (REIT) Common Shares of Beneficial Interest,Real Estate,424551751.0
CLDX,Celldex Therapeutics Inc.,Health Care,1593588549.0
CLF,Cleveland-Cliffs Inc. Common Stock,Basic Materials,4944374966.0
CLFD,Clearfield Inc. Common Stock,Utilities,578545697.0
CLH,Clean Harbors Inc. Common Stock,Industrials,12921770953.0
CLIR,ClearSign Technologies Corporation Common Stock (DE),Industrials,65807073.0
CLM,Cornerstone Strategic Investment Fund Inc. Common Shares,Finance,0.0
CLMB,Climb Global Solutions Inc. Common Stock,Technology,611274965.0
CLMT,Calumet Inc. Common Stock,Energy,1432880471.0
CLNE,Clean Energy Fuels Corp. Common Stock,Utilities,703888076.0
CLNN,Clene Inc. Common Stock,Health Care,39419846.0
CLNNW,Clene Inc. Warrant,Health Care,379037.0
CLOV,Clover Health Investments Corp. Class A Common Stock,Health Care,2415345554.0
CLPR,Clipper Realty Inc. Common Stock,Real Estate,64630706.0
CLPT,ClearPoint Neuro Inc. Common Stock,Health Care,492386877.0
CLRB,Cellectar Biosciences Inc.  Common Stock,Health Care,10672378.0
CLRO,ClearOne Inc. (DE) Common Stock,Utilities,14201720.0
CLSD,Clearside Biomedical Inc. Common Stock,Health Care,70534459.0
CLSK,CleanSpark Inc. Common Stock,Finance,3373236021.0
CLSKW,CleanSpark Inc. Warrant,Finance,230567850.0
CLST,Catalyst Bancorp Inc. Common Stock,Finance,50980093.0
CLW,Clearwater Paper Corporation Common Stock,Basic Materials,519066730.0
CLX,Clorox Company (The) Common Stock,Consumer Discretionary,19714650518.0
CLYM,Climb Bio Inc. Common Stock,Health Care,121675006.0
CMA,Comerica Incorporated Common Stock,Finance,8320902042.0
CMC,Commercial Metals Company Common Stock,Industrials,5671847914.0
CMCO,Columbus McKinnon Corporation Common Stock,Industrials,1072713641.0
CMCSA,Comcast Corporation Class A Common Stock,Telecommunications,144000000000.0
CMCT,Creative Media & Community Trust Corporation Common stock,Real Estate,8983307.0
CME,CME Group Inc. Class A Common Stock,Finance,84569801331.0
CMG,Chipotle Mexican Grill Inc. Common Stock,Consumer Discretionary,77259023100.0
CMI,Cummins Inc. Common Stock,Industrials,50430792432.0
CMLS,Cumulus Media Inc. Class A Common Stock,Consumer Discretionary,14891331.0
CMP,Compass Minerals Intl Inc Common Stock,Industrials,556296482.0
CMPO,CompoSecure Inc. Class A Common Stock,Finance,1394232547.0
CMPOW,CompoSecure Inc. Warrant,Finance,433604559.0
CMPX,Compass Therapeutics Inc. Common Stock,Health Care,364611303.0
CMRX,Chimerix Inc. Common Stock,Health Care,356146770.0
CMS,CMS Energy Corporation Common Stock,Utilities,19666019814.0
CMSA,CMS Energy Corporation 5.625% Junior Subordinated Notes due 2078,Utilities,6818270619.0
CMSC,CMS Energy Corporation 5.875% Junior Subordinated Notes due 2078,Utilities,7051322814.0
CMSD,CMS Energy Corporation 5.875% Junior Subordinated Notes due 2079,Utilities,7158885365.0
CMT,Core Molding Technologies Inc Common Stock,Industrials,133434864.0
CMTG,Claros Mortgage Trust Inc. Common Stock,Finance,490556553.0
CMTL,Comtech Telecommunications Corp. Common Stock,Technology,71468663.0
CMU,MFS Municipal Income Trust Common Stock,Finance,99280226.0
CNA,CNA Financial Corporation Common Stock,Finance,13192734083.0
CNC,Centene Corporation Common Stock,Health Care,32604181700.0
CNDT,Conduent Incorporated Common Stock ,Consumer Discretionary,636360612.0
CNFR,Conifer Holdings Inc. Common Stock,Finance,12711796.0
CNFRZ,Conifer Holdings Inc. 9.75% Senior Unsecured Notes due 2028,,302516305.0
CNK,Cinemark Holdings Inc Cinemark Holdings Inc. Common Stock,Consumer Discretionary,3559584003.0
CNM,Core & Main Inc. Class A Common Stock,Consumer Discretionary,11213112191.0
CNMD,CONMED Corporation Common Stock,Health Care,2124363961.0
CNNE,Cannae Holdings Inc. Common Stock,Consumer Discretionary,1205856342.0
CNO,CNO Financial Group Inc. Common Stock,Finance,4010702478.0
CNOB,ConnectOne Bancorp Inc. Common Stock,Finance,890958761.0
CNOBP,ConnectOne Bancorp Inc. Depositary Shares each representing a 1/40th interest in a share of 5.25% Fixed-Rate Reset Non-Cumulative Perpetual Preferred Stock Series A,Finance,898552246.0
CNP,CenterPoint Energy Inc (Holding Co) Common Stock,Utilities,21089894651.0
CNR,Core Natural Resources Inc. Common Stock,Energy,2843326696.0
CNS,Cohen & Steers Inc Common Stock,Finance,4490540066.0
CNSP,CNS Pharmaceuticals Inc. Common Stock,Health Care,6082093.0
CNTM,ConnectM Technology Solutions Inc. Common Stock,Consumer Discretionary,25711359.0
CNTX,Context Therapeutics Inc. Common Stock,Health Care,67648477.0
CNTY,Century Casinos Inc. Common Stock,Consumer Discretionary,94502417.0
CNVS,Cineverse Corp. Class A Common Stock,Consumer Discretionary,59841659.0
CNX,CNX Resources Corporation Common Stock,Energy,4276620883.0
CNXC,Concentrix Corporation Common Stock,Technology,3405577072.0
CNXN,PC Connection Inc. Common Stock,Consumer Discretionary,1915188618.0
COCH,Envoy Medical Inc. Class A Common Stock,Health Care,32594233.0
COCHW,Envoy Medical Inc Warrant,Health Care,1087149.0
COCO,The Vita Coco Company Inc. Common Stock,Consumer Staples,2192689442.0
COCP,Cocrystal Pharma Inc. Common Stock,Health Care,21479923.0
CODA,Coda Octopus Group Inc. Common stock,Industrials,91131264.0
CODI,D/B/A Compass Diversified Holdings Shares of Beneficial Interest,Consumer Discretionary,1606854555.0
CODX,Co-Diagnostics Inc. Common Stock,Health Care,25671521.0
COEP,Coeptis Therapeutics Holdings Inc. Common Stock,Health Care,24486126.0
COEPW,Coeptis Therapeutics Holdings Inc. Warrants,Health Care,56127.0
COF,Capital One Financial Corporation Common Stock,Finance,77648798686.0
COFS,ChoiceOne Financial Services Inc. Common Stock,Finance,307246606.0
COGT,Cogent Biosciences Inc. Common Stock,Health Care,922355437.0
COHN,Cohen & Company Inc.,Finance,19501520.0
COHR,Coherent Corp. Common Stock,Technology,15517437314.0
COHU,Cohu Inc. Common Stock,Industrials,1116398977.0
COIN,Coinbase Global Inc. Class A Common Stock,Finance,74604432014.0
COKE,Coca-Cola Consolidated Inc. Common Stock,Consumer Staples,11318797268.0
COLB,Columbia Banking System Inc. Common Stock,Finance,5858492548.0
COLD,Americold Realty Trust Inc. Common Stock,Real Estate,6162718968.0
COLL,Collegium Pharmaceutical Inc. Common Stock,Health Care,726758401.0
COLM,Columbia Sportswear Company Common Stock,Consumer Discretionary,5110326788.0
COMM,CommScope Holding Company Inc. Common Stock,Technology,1193809664.0
COMP,Compass Inc. Class A Common Stock,Technology,3567047265.0
CON,Concentra Group Holdings Parent Inc. Common Stock,Health Care,2995119191.0
COO,The Cooper Companies Inc. Common Stock,Health Care,19499222560.0
COOK,Traeger Inc. Common Stock,Consumer Discretionary,318668531.0
COOP,Mr. Cooper Group Inc. Common Stock,Finance,6661984510.0
COP,ConocoPhillips Common Stock,Energy,117000000000.0
COR,Cencora Inc. Common Stock,Health Care,48026249187.0
CORT,Corcept Therapeutics Incorporated Common Stock,Health Care,6285460469.0
CORZ,Core Scientific Inc. Common Stock,Finance,4462463324.0
CORZW,Core Scientific Inc. Tranche 1 Warrants,Finance,2750642286.0
CORZZ,Core Scientific Inc. Tranche 2 Warrants,Finance,4440123082.0
COSM,Cosmos Health Inc. Common Stock,Health Care,18293964.0
COST,Costco Wholesale Corporation Common Stock,Consumer Discretionary,417000000000.0
COTY,Coty Inc. Class A Common Stock,Consumer Discretionary,6480742782.0
COUR,Coursera Inc. Common Stock,Technology,1370158391.0
COYA,Coya Therapeutics Inc. Common Stock,Health Care,98573902.0
CPAY,Corpay Inc. Common Stock,Consumer Discretionary,26440678363.0
CPB,The Campbell's Company Common Stock,Consumer Staples,11620298331.0
CPBI,Central Plains Bancshares Inc. Common Stock,Finance,60309899.0
CPF,Central Pacific Financial Corp New,Finance,771608924.0
CPHC,Canterbury Park Holding Corporation 'New' Common Stock,Consumer Discretionary,102901985.0
CPIX,Cumberland Pharmaceuticals Inc. Common Stock,Health Care,36369567.0
CPK,Chesapeake Utilities Corporation Common Stock,Utilities,2759896222.0
CPNG,Coupang Inc. Class A Common Stock,Consumer Discretionary,40582270185.0
CPRT,Copart Inc. (DE) Common Stock,Consumer Discretionary,55595588795.0
CPRX,Catalyst Pharmaceuticals Inc. Common Stock,Health Care,2689615982.0
CPS,Cooper-Standard Holdings Inc. Common Stock,Consumer Discretionary,290392660.0
CPSH,CPS Technologies Corp. Common Stock,Consumer Discretionary,28906660.0
CPSS,Consumer Portfolio Services Inc. Common Stock,Finance,250868921.0
CPT,Camden Property Trust Common Stock,Real Estate,11803221355.0
CPZ,Calamos Long/Short Equity & Dynamic Income Trust Common Stock,Finance,304102685.0
CQP,Cheniere Energy Partners LP Common Units,Utilities,29865676639.0
CR,Crane Company Common Stock,Industrials,9253281239.0
CRAI,CRA International Inc. Common Stock,Consumer Discretionary,1277704147.0
CRBD,Corebridge Financial Inc. 6.375% Junior Subordinated Notes due 2064,Finance,0.0
CRBG,Corebridge Financial Inc. Common Stock,Finance,18920620091.0
CRBP,Corbus Pharmaceuticals Holdings Inc. Common Stock,Health Care,128128151.0
CRBU,Caribou Biosciences Inc. Common Stock,Health Care,136734557.0
CRC,California Resources Corporation Common Stock,Energy,4815448454.0
CRCT,Cricut Inc. Class A Common Stock,Technology,1241650307.0
CRDF,Cardiff Oncology Inc. Common Stock,Health Care,174366077.0
CRDO,Credo Technology Group Holding Ltd Ordinary Shares,Technology,13457727963.0
CREX,Creative Realities Inc. Common Stock,Technology,26534514.0
CRF,Cornerstone Total Return Fund Inc. (The) Common Stock,Finance,0.0
CRGX,CARGO Therapeutics Inc. Common Stock,,619533205.0
CRGY,Crescent Energy Company Class A Common Stock,Energy,3650418646.0
CRI,Carter's Inc. Common Stock,Consumer Discretionary,1950781002.0
CRIS,Curis Inc. Common Stock,Health Care,28956993.0
CRK,Comstock Resources Inc. Common Stock,Energy,5994265829.0
CRKN,Crown Electrokinetics Corp. Common Stock,Technology,951557.0
CRL,Charles River Laboratories International Inc. Common Stock,Health Care,8435935285.0
CRM,Salesforce Inc. Common Stock,Technology,320000000000.0
CRMD,CorMedix Inc. Common Stock,Health Care,753610874.0
CRMT,America's Car-Mart Inc Common Stock,Consumer Discretionary,410815025.0
CRNC,Cerence Inc. Common Stock,Technology,601302158.0
CRNX,Crinetics Pharmaceuticals Inc. Common Stock,Health Care,3597292551.0
CROX,Crocs Inc. Common Stock,Consumer Discretionary,6037448540.0
CRS,Carpenter Technology Corporation Common Stock,Industrials,10495831749.0
CRSR,Corsair Gaming Inc. Common Stock,Technology,958531869.0
CRT,Cross Timbers Royalty Trust Common Stock,Energy,66420000.0
CRUS,Cirrus Logic Inc. Common Stock,Technology,5388918577.0
CRVL,CorVel Corp. Common Stock,Finance,5862807938.0
CRVO,CervoMed Inc. Common Stock,Health Care,19066142.0
CRVS,Corvus Pharmaceuticals Inc. Common Stock,Health Care,339278285.0
CRWD,CrowdStrike Holdings Inc. Class A Common Stock,Technology,92347074587.0
CRWS,Crown Crafts Inc Common Stock,Consumer Discretionary,46460022.0
CSBR,Champions Oncology Inc. Common Stock,Health Care,160303138.0
CSCO,Cisco Systems Inc. Common Stock (DE),Telecommunications,248000000000.0
CSGP,CoStar Group Inc. Common Stock,Consumer Discretionary,30402597781.0
CSGS,CSG Systems International Inc. Common Stock,Technology,1587586511.0
CSL,Carlisle Companies Incorporated Common Stock,Industrials,18258357788.0
CSLR,Complete Solaria Inc. Common Stock,Technology,134994100.0
CSLRW,Complete Solaria Inc. Warrants,Technology,6565287.0
CSPI,CSP Inc. Common Stock,Technology,167609116.0
CSQ,Calamos Strategic Total Return Common Stock,Finance,2929887750.0
CSR,D/B/A Centerspace Common Stock,Real Estate,1012381953.0
CSTL,Castle Biosciences Inc. Common Stock,Health Care,740513038.0
CSV,Carriage Services Inc. Common Stock,Consumer Discretionary,603291612.0
CSWC,Capital Southwest Corporation Common Stock,Consumer Discretionary,1067228010.0
CSWCZ,Capital Southwest Corporation 7.75% Notes due 2028,Finance,1202707217.0
CSWI,CSW Industrials Inc. Common Stock,Industrials,6171512370.0
CSX,CSX Corporation Common Stock,Industrials,63040022112.0
CTAS,Cintas Corporation Common Stock,Consumer Discretionary,79655536737.0
CTBB,Qwest Corporation 6.5% Notes due 2056,Telecommunications,18.0
CTBI,Community Trust Bancorp Inc. Common Stock,Finance,972057995.0
CTCX,Carmell Corporation Common Stock,Health Care,9438791.0
CTCXW,Carmell Corporation Warrant,Health Care,679426.0
