Ticker,Company,Sector,Market Cap
OCFC,OceanFirst Financial Corp. Common Stock,Finance,1099711865
OCFCP,OceanFirst Financial Corp. Depositary Shares,Finance,1482067825
OCGN,Ocugen Inc. Common Stock,Health Care,227229818
OCSL,Oaktree Specialty Lending Corporation Common Stock,Finance,1288784149
OCTO,Eightco Holdings Inc. Common Stock,,4077076
OCUL,Ocular Therapeutix Inc. Common Stock,Health Care,1253022893
OCX,Oncocyte Corporation Common Stock,Health Care,34175551
ODFL,Old Dominion Freight Line Inc. Common Stock,Industrials,40737464844
ODP,The ODP Corporation Common Stock,Consumer Discretionary,677358183
OESX,Orion Energy Systems Inc. Common Stock,Consumer Discretionary,26325385
OFLX,Omega Flex Inc. Common Stock,Industrials,419923795
OFS,OFS Capital Corporation Common Stock,Finance,108658413
OFSSH,OFS Capital Corporation 4.95% Notes due 2028,Finance,302260640
OKTA,Okta Inc. Class A Common Stock,Technology,15226593126
OKUR,OnKure Therapeutics Inc. Class A Common Stock,Health Care,75501100
OLB,The OLB Group Inc. Common Stock,Consumer Discretionary,2862637
OLED,Universal Display Corporation Common Stock,Technology,7152434186
OLLI,Ollie's Bargain Outlet Holdings Inc. Common Stock,Consumer Discretionary,6918772408
OLMA,Olema Pharmaceuticals Inc. Common Stock,Health Care,340922178
OLPX,Olaplex Holdings Inc. Common Stock,Consumer Discretionary,1080564166
OM,Outset Medical Inc. Common Stock,Health Care,44676483
OMCC,Old Market Capital Corporation Common Stock,Finance,78232000
OMCL,Omnicell Inc. Common Stock ($0.001 par value),Technology,2020803075
OMER,Omeros Corporation Common Stock,Health Care,485039491
OMEX,Odyssey Marine Exploration Inc. Common Stock,Consumer Discretionary,14189932
OMGA,Omega Therapeutics Inc. Common Stock,Health Care,28181402
OMIC,Singular Genomics Systems Inc. Common Stock,Industrials,49934246
ON,ON Semiconductor Corporation Common Stock,Technology,23205960371
ONB,Old National Bancorp Common Stock,Finance,7358684040
ONBPO,Old National Bancorp Depositary Shares Each Representing a 1/40th Interest in a Share of Series C Preferred Stock,Finance,7990248600
ONBPP,Old National Bancorp Depositary Shares Each Representing a 1/40th Interest in a Share of Series A Preferred Stock,Finance,8025335520
ONCO,Onconetix Inc. Common Stock,Health Care,3981472
ONDS,Ondas Holdings Inc. Common Stock,Technology,157676820
ONEW,OneWater Marine Inc. Class A Common Stock,Consumer Discretionary,277497363
ONFO,Onfolio Holdings Inc. Common Stock,Technology,6563067
ONFOW,Onfolio Holdings Inc. Warrant,Technology,1179301
ONVO,Organovo Holdings Inc. Common Stock,Health Care,5255112
OPAL,OPAL Fuels Inc. Class A Common Stock,Utilities,532311823
OPBK,OP Bancorp Common Stock,Finance,210177611
OPCH,Option Care Health Inc. Common Stock,Health Care,5161596949
OPEN,Opendoor Technologies Inc Common Stock,Finance,1001097651
OPI,Office Properties Income Trust Common Shares of Beneficial Interest,Finance,51045394
OPINL,Office Properties Income Trust 6.375% Senior Notes due 2050,Finance,669932440
OPK,OPKO Health Inc. Common Stock,Health Care,1010074883
OPOF,Old Point Financial Corporation Common Stock,Finance,124301974
OPRT,Oportun Financial Corporation Common Stock,Finance,137769072
OPRX,OptimizeRx Corporation Common Stock,Consumer Discretionary,100025520
OPTN,OptiNose Inc. Common Stock,Health Care,65862215
OPTX,Syntec Optics Holdings Inc. Class A Common Stock,Technology,77045359
OPTXW,Syntec Optics Holdings Inc. Warrant,Technology,3668827
OPXS,Optex Systems Holdings Inc. Common Stock,Technology,46828851
ORGN,Origin Materials Inc. Common Stock,Industrials,149175170
ORGNW,Origin Materials Inc. Warrants,Industrials,14625017
ORGO,Organogenesis Holdings Inc. Class A Common Stock,Health Care,471972347
ORIC,Oric Pharmaceuticals Inc. Common Stock,Health Care,728956594
ORKA,Oruka Therapeutics Inc. Common Stock,Health Care,426632325
ORLY,O'Reilly Automotive Inc. Common Stock,Consumer Discretionary,72394289022
ORRF,Orrstown Financial Services Inc. Common Stock,Finance,697703616
OS,OneStream Inc. Class A Common Stock,Technology,7122321287
OSBC,Old Second Bancorp Inc. Common Stock,Finance,826201231
OSIS,OSI Systems Inc. Common Stock (DE),Technology,3339977403
OSPN,OneSpan Inc. Common Stock,Technology,737026486
OSS,One Stop Systems Inc. Common Stock,Technology,82768973
OSUR,OraSure Technologies Inc. Common Stock,Health Care,299122558
OTLK,Outlook Therapeutics Inc. Common Stock,Health Care,49562214
OTRK,Ontrak Inc. Common Stock,Health Care,7254695
OTTR,Otter Tail Corporation Common Stock,Utilities,3245013680
OUST,Ouster Inc. Common Stock,Industrials,541537913
OUSTW,Ouster Inc. Warrants,Industrials,1739548
OUSTZ,Ouster Inc. Warrants,Industrials,5694949
OVBC,Ohio Valley Banc Corp. Common Stock,Finance,104113122
OVID,Ovid Therapeutics Inc. Common Stock,Health Care,52128343
OVLY,Oak Valley Bancorp (CA) Common Stock,Finance,217744422
OXLC,Oxford Lane Capital Corp. Common Stock,Finance,888832000
OXLCI,Oxford Lane Capital Corp. 8.75% Notes due 2030,,0
OXLCL,Oxford Lane Capital Corp. 6.75% Notes due 2031,Finance,4101716640
OXLCN,Oxford Lane Capital Corp. 7.125% Series 2029 Term Preferred Stock,Finance,4230632000
OXLCO,Oxford Lane Capital Corp. Preferred Stock Shares 6.00% Series 2029,Finance,3984102640
OXLCP,Oxford Lane Capital Corp. 6.25% Series 2027 Term Preferred Shares,Finance,4193290640
OXLCZ,Oxford Lane Capital Corp. 5.00% Notes due 2027,Finance,4136888000
OXSQ,Oxford Square Capital Corp. Common Stock,Finance,181272123
OXSQG,Oxford Square Capital Corp. 5.50% Notes due 2028,Consumer Discretionary,1490658767
OXSQZ,Oxford Square Capital Corp. 6.25% Notes due 2026,Finance,0
OZK,Bank OZK Common Stock,Finance,5762023203
OZKAP,Bank OZK 4.625% Series A Non-Cumulative Perpetual Preferred Stock,Finance,1957255084
PAA,Plains All American Pipeline L.P. Common Units representing Limited Partner Interests,Energy,14347812113
PACB,Pacific Biosciences of California Inc. Common Stock,Industrials,462829389
PAGP,Plains GP Holdings L.P. Class A Units representing Limited Partner Interests,Energy,4296853610
PAHC,Phibro Animal Health Corporation Class A Common Stock,Health Care,887434051
PAL,Proficient Auto Logistics Inc. Common Stock,Consumer Discretionary,278677042
PALI,Palisade Bio Inc. Common Stock,Health Care,2020864
PAMT,PAMT CORP Common Stock,Industrials,356797907
PANL,Pangaea Logistics Solutions Ltd. Common Shares,Consumer Discretionary,255147375
PANW,Palo Alto Networks Inc. Common Stock,Technology,1.23169E+11
PARA,Paramount Global Class B Common Stock,Industrials,7383415198
PARAA,Paramount Global Class A Common Stock,Industrials,15147006247
PASG,Passage Bio Inc. Common Stock,Health Care,37430975
PATK,Patrick Industries Inc. Common Stock,Consumer Discretionary,3178188623
PAVM,PAVmed Inc. Common Stock,Health Care,7172431
PAVMZ,PAVmed Inc. Series Z Warrant,Health Care,220264
PAYO,Payoneer Global Inc. Common Stock,Consumer Discretionary,3633891392
PAYS,Paysign Inc. Common Stock,Consumer Discretionary,153683833
PAYX,Paychex Inc. Common Stock,Consumer Discretionary,52608815742
PBBK,PB Bankshares Inc. Common Stock,Finance,38281725
PBFS,Pioneer Bancorp Inc. Common Stock,Finance,306492067
PBHC,Pathfinder Bancorp Inc. Common Stock (MD),Finance,100651172
PBPB,Potbelly Corporation Common Stock,Consumer Discretionary,369723062
PBYI,Puma Biotechnology Inc Common Stock,Health Care,145299545
PCAR,PACCAR Inc. Common Stock,Consumer Discretionary,57620630885
PCB,PCB Bancorp Common Stock,Finance,269783770
PCH,PotlatchDeltic Corporation Common Stock,Real Estate,3285204730
PCRX,Pacira BioSciences Inc. Common Stock,Health Care,1132167845
PCSA,Processa Pharmaceuticals Inc. Common Stock,Health Care,2228056
PCSC,Perceptive Capital Solutions Corp Class A Ordinary Shares,,0
PCT,PureCycle Technologies Inc. Common stock,Industrials,1695014300
PCTTW,PureCycle Technologies Inc. Warrant,Industrials,595076668
PCTY,Paylocity Holding Corporation Common Stock,Technology,11511707592
PCVX,Vaxcyte Inc. Common Stock,Health Care,11172419983
PCYO,Pure Cycle Corporation Common Stock,Utilities,268698304
PDCO,Patterson Companies Inc. Common Stock,Health Care,2731613880
PDEX,Pro-Dex Inc. Common Stock,Health Care,132524683
PDFS,PDF Solutions Inc. Common Stock,Technology,1068192403
PDLB,Ponce Financial Group Inc. Common Stock,Finance,311446010
PDSB,PDS Biotechnology Corporation Common Stock,Health Care,57984162
PDYN,Palladyne AI Corp. Common Stock,Technology,296908254
PDYNW,Palladyne AI Corp Warrants,Technology,18067439
PEBK,Peoples Bancorp of North Carolina Inc. Common Stock,Finance,155870370
PEBO,Peoples Bancorp Inc. Common Stock,Finance,1161389324
PECO,Phillips Edison & Company Inc. Common Stock,Real Estate,4489612000
PEGA,Pegasystems Inc. Common Stock,Technology,9270844183
PENG,Penguin Solutions Inc. Ordinary Shares,Technology,1098855265
PENN,PENN Entertainment Inc. Common Stock,Consumer Discretionary,3083113920
PEP,PepsiCo Inc. Common Stock,Consumer Staples,2.04591E+11
PEPG,PepGen Inc. Common Stock,Health Care,63235730
PESI,Perma-Fix Environmental Services Inc. Common Stock,Industrials,166826878
PET,Wag! Group Co. Common Stock,Consumer Discretionary,12741548
PETS,PetMed Express Inc. Common Stock,Consumer Staples,102076297
PETWW,Wag! Group Co Warrant,Consumer Discretionary,946031
PEV,Phoenix Motor Inc. Common Stock,Consumer Discretionary,9412123
PFBC,Preferred Bank Common Stock,Finance,1235251328
PFC,Premier Financial Corp. Common Stock,Finance,978465961
PFG,Principal Financial Group Inc Common Stock,Finance,18716637369
PFIS,Peoples Financial Services Corp. Common Stock,Finance,508227800
PFX,PhenixFIN Corporation Common Stock,Finance,98847935
PFXNZ,PhenixFIN Corporation  5.25% Notes due 2028,Finance,46111532
PGC,Peapack-Gladstone Financial Corporation Common Stock,Finance,565191735
PGEN,Precigen Inc. Common Stock,Health Care,407088045
PGNY,Progyny Inc. Common Stock,Health Care,1881035668
PGY,Pagaya Technologies Ltd. Class A Ordinary Shares,Finance,711513386
PGYWW,Pagaya Technologies Ltd. Warrants,Finance,6297556
PHAT,Phathom Pharmaceuticals Inc. Common Stock,Health Care,471803915
PHIO,Phio Pharmaceuticals Corp. Common Stock,Health Care,2332034
PHLT,Performant Healthcare Inc. Common Stock,Consumer Discretionary,190248015
PI,Impinj Inc. Common Stock,Technology,3853184894
PIII,P3 Health Partners Inc. Class A Common Stock,Health Care,71082298
PIIIW,P3 Health Partners Inc. Warrant,Health Care,8934625
PINC,Premier Inc. Class A Common Stock,Consumer Discretionary,2151871442
PKBK,Parke Bancorp Inc. Common Stock,Finance,237691880
PKOH,Park-Ohio Holdings Corp. Common Stock,Industrials,346834708
PLAB,Photronics Inc. Common Stock,Technology,1476347894
PLAY,Dave & Buster's Entertainment Inc. Common Stock,Consumer Discretionary,1058829365
PLBC,Plumas Bancorp,Finance,274049065
PLBY,PLBY Group Inc. Common Stock,Consumer Discretionary,162599877
PLCE,Children's Place Inc. (The) Common Stock,Consumer Discretionary,132618710
PLL,Piedmont Lithium Inc. Common Stock,Industrials,173578054
PLMJ,Plum Acquisition Corp. III Class A Ordinary Shares,,0
PLMJU,Plum Acquisition Corp. III Unit,,0
PLMJW,Plum Acquisition Corp. III Warrant,,0
PLMKU,Plum Acquisition Corp. IV Unit,,0
PLMR,Palomar Holdings Inc. Common stock,Finance,2738952576
PLPC,Preformed Line Products Company Common Stock,Industrials,694479113
PLRX,Pliant Therapeutics Inc. Common Stock,Health Care,664521563
PLSE,Pulse Biosciences Inc Common Stock (DE),Health Care,1114682187
PLTR,Palantir Technologies Inc. Class A Common Stock,Technology,1.79839E+11
PLUG,Plug Power Inc. Common Stock,Energy,1895289627
PLUS,ePlus inc. Common Stock,Technology,2179617683
PLXS,Plexus Corp. Common Stock,Technology,4131318399
PMCB,PharmaCyte  Biotech Inc. Common Stock,Health Care,11358058
PMTS,CPI Card Group Inc. Common Stock,Consumer Discretionary,322953557
PMVP,PMV Pharmaceuticals Inc. Common Stock,Health Care,70893568
PNBK,Patriot National Bancorp Inc. Common Stock,Finance,6401478
PNFP,Pinnacle Financial Partners Inc. Common Stock,Finance,9522782092
PNFPP,Pinnacle Financial Partners Inc. Depositary shares of Pinnacle Financial Partners Inc. each representing a 1/40th Interest in a share of its 6.75% Fixed-Rate Non-Cumulative Perpetual Preferred Stock Series B,Finance,1923404235
PNRG,PrimeEnergy Resources Corporation Common Stock,Energy,384033000
PNTG,The Pennant Group Inc. Common Stock ,Health Care,949388919
POAI,Predictive Oncology Inc. Common Stock,Health Care,9800480
POCI,Precision Optics Corporation Inc. Common stock,Health Care,32385867
PODC,PodcastOne Inc. Common Stock,Technology,54985860
PODD,Insulet Corporation Common Stock,Health Care,19665087671
POLA,Polar Power Inc. Common Stock,Miscellaneous,8003078
POLE,Andretti Acquisition Corp. II Class A Ordinary Shares,,0
POLEU,Andretti Acquisition Corp. II Unit,,0
POLEW,Andretti Acquisition Corp. II Warrant,,0
POOL,Pool Corporation Common Stock,Consumer Discretionary,13461762121
POWI,Power Integrations Inc. Common Stock,Technology,3521625979
POWL,Powell Industries Inc. Common Stock,Energy,3494964678
POWW,AMMO Inc. Common Stock,Industrials,187635638
POWWP,AMMO Inc. 8.75% Series A Cumulative Redeemable Perpetual Preferred Stock,Industrials,2701715676
PPBI,Pacific Premier Bancorp Inc,Finance,2408122406
PPC,Pilgrim's Pride Corporation Common Stock,Consumer Staples,10805697890
PPIH,Perma-Pipe International Holdings Inc. Common Stock,Industrials,128279868
PPSI,Pioneer Power Solutions Inc. Common Stock,Industrials,43499387
PRAA,PRA Group Inc. Common Stock,Finance,856347881
PRAX,Praxis Precision Medicines Inc. Common Stock,Health Care,1437158984
PRCH,Porch Group Inc. Common Stock,Technology,527187201
PRCT,PROCEPT BioRobotics Corporation Common Stock,Health Care,3833376697
PRDO,Perdoceo Education Corporation Common Stock,Real Estate,1860430067
PRGS,Progress Software Corporation Common Stock (DE),Technology,2298592563
PRLD,Prelude Therapeutics Incorporated Common Stock,Health Care,66867732
PRME,Prime Medicine Inc. Common Stock,Health Care,413156652
PROK,ProKidney Corp. Class A Ordinary Shares,Health Care,501658554
PROP,Prairie Operating Co. Common Stock,Finance,213832059
PROV,Provident Financial Holdings Inc. Common Stock,Finance,106855384
PRPH,ProPhase Labs Inc. Common Stock (DE),Health Care,12891976
PRPL,Purple Innovation Inc. Common Stock,Consumer Discretionary,134637768
PRPO,Precipio Inc.  Common Stock,Industrials,9679634
PRSO,Peraso Inc. Common Stock,Technology,3464259
PRTA,Prothena Corporation plc Ordinary Shares,Health Care,840492394
PRTC,PureTech Health plc American Depositary Shares,Health Care,442929424
PRTH,Priority Technology Holdings Inc. Common Stock,Consumer Discretionary,702982014
PRTS,CarParts.com Inc. Common Stock,Consumer Discretionary,76341525
PRVA,Privia Health Group Inc. Common Stock,Health Care,2709630596
PSEC,Prospect Capital Corporation Common Stock,Finance,1910450806
PSIX,Power Solutions International Inc. Common Stock,Industrials,988983488
PSMT,PriceSmart Inc. Common Stock,Consumer Discretionary,2783834303
PSNL,Personalis Inc. Common Stock,Health Care,432366274
PSTV,PLUS THERAPEUTICS Inc. Common Stock ,Health Care,7252490
PTC,PTC Inc. Common Stock,Technology,22699590957
PTCT,PTC Therapeutics Inc. Common Stock,Health Care,3582462892
PTEN,Patterson-UTI Energy Inc. Common Stock,Energy,3412118964
PTGX,Protagonist Therapeutics Inc. Common Stock,Health Care,2246249298
PTIX,Protagenic Therapeutics Inc. Common Stock,Health Care,3023695
PTLO,Portillo's Inc. Class A Common Stock,Consumer Discretionary,927035428
PTMN,Portman Ridge Finance Corporation Common Stock,Finance,153672490
PTON,Peloton Interactive Inc. Class A Common Stock,Consumer Discretionary,3204257188
PTPI,Petros Pharmaceuticals Inc. Common Stock,Health Care,3284878
PTVE,Pactiv Evergreen Inc. Common stock,Consumer Discretionary,3186006046
PUBM,PubMatic Inc. Class A Common Stock,Technology,715068158
PULM,Pulmatrix Inc. Common Stock,Health Care,26588635
PVBC,Provident Bancorp Inc. (MD) Common Stock,Finance,202122490
PVLA,Palvella Therapeutics Inc. Common Stock,Health Care,16489798
PWOD,Penns Woods Bancorp Inc. Common Stock,Finance,233805016
PWP,Perella Weinberg Partners Class A Common Stock,Finance,2298421845
PWUP,PowerUp Acquisition Corp. Class A Ordinary Shares,Finance,0
PWUPU,PowerUp Acquisition Corp. Unit,Finance,0
PWUPW,PowerUp Acquisition Corp. Warrant,Finance,0
PXLW,Pixelworks Inc.  Common Stock,Technology,51871693
PYCR,Paycor HCM Inc. Common Stock,Technology,3992018914
PYPL,PayPal Holdings Inc. Common Stock,Consumer Discretionary,89336234963
PYXS,Pyxis Oncology Inc. Common Stock,Health Care,95145166
PZZA,Papa John's International Inc. Common Stock,Consumer Discretionary,1272044048
QCOM,QUALCOMM Incorporated Common Stock,Technology,1.91214E+11
QCRH,QCR Holdings Inc. Common Stock,Finance,1328428316
QDEL,QuidelOrtho Corporation Common Stock,Health Care,2975437160
QETA,Quetta Acquisition Corporation Common Stock,Finance,0
QETAR,Quetta Acquisition Corporation Right,Finance,0
QETAU,Quetta Acquisition Corporation Unit,Finance,0
QIPT,Quipt Home Medical Corp. Common Shares,Health Care,128842906
QLGN,Qualigen Therapeutics Inc. Common Stock,Health Care,3129832
QLYS,Qualys Inc. Common Stock,Technology,5237557299
QMCO,Quantum Corporation Common Stock,Technology,157915059
QNCX,Quince Therapeutics Inc. Common Stock,Health Care,69962612
QNST,QuinStreet Inc. Common Stock,Consumer Discretionary,1214717522
QQQX,Nuveen NASDAQ 100 Dynamic Overwrite Fund Shares of Beneficial Interest,Finance,0
QRHC,Quest Resource Holding Corporation Common Stock,Utilities,118996762
QRTEA,Qurate Retail Inc. Series A Common Stock,Consumer Discretionary,152825759
QRTEB,Qurate Retail Inc. Series B Common Stock,Consumer Discretionary,869320553
QRTEP,Qurate Retail Inc. 8.0% Fixed Rate Cumulative Redeemable Preferred Stock,Consumer Discretionary,14536309879
QRVO,Qorvo Inc. Common Stock,Technology,8407204520
QSI,Quantum-Si Incorporated Class A Common Stock,Industrials,328239560
QSIAW,Quantum-Si Incorporated Warrant,Industrials,138431466
QTI,QT Imaging Holdings Inc. Common Stock,Health Care,11172461
QTRX,Quanterix Corporation Common Stock,Industrials,368677800
QTTB,Q32 Bio Inc. Common Stock,Health Care,42876068
QUBT,Quantum Computing Inc. Common Stock,Technology,1083015183
QUIK,QuickLogic Corporation Common Stock,Technology,135010921
RAIL,FreightCar America Inc. Common Stock,Industrials,248455732
RAIN,Rain Enhancement Technologies Holdco Inc. Class A Common Stock,Technology,25809676
RAINW,Rain Enhancement Technologies Holdco Inc. Warrants,Technology,861427
RAND,Rand Capital Corporation Common Stock,Finance,58692418
RANG,Range Capital Acquisition Corp. Ordinary Shares,,0
RANGR,Range Capital Acquisition Corp. Rights,,0
RANGU,Range Capital Acquisition Corp. Units,,0
RANI,Rani Therapeutics Holdings Inc. Class A Common Stock,Health Care,85933023
RAPP,Rapport Therapeutics Inc. Common Stock,Health Care,508412752
RAPT,RAPT Therapeutics Inc. Common Stock,Health Care,41250739
RARE,Ultragenyx Pharmaceutical Inc. Common Stock,Health Care,4067765005
RAVE,Rave Restaurant Group Inc. Common Stock,Consumer Discretionary,38102956
RBB,RBB Bancorp Common Stock,Finance,345906283
RBBN,Ribbon Communications Inc. Common Stock,Technology,720826954
RBCAA,Republic Bancorp Inc. Class A Common Stock,Finance,1302676688
RBKB,Rhinebeck Bancorp Inc. Common Stock,Finance,110432566
RCAT,Red Cat Holdings Inc. Common Stock,Technology,691787549
RCEL,Avita Medical Inc. Common Stock,Health Care,244348302
RCKT,Rocket Pharmaceuticals Inc. Common Stock,Health Care,976292380
RCKTW,Rocket Pharmaceuticals Inc. Warrant,Health Care,6380996
RCKY,Rocky Brands Inc. Common Stock,Consumer Discretionary,190444948
RCMT,RCM Technologies Inc. Common Stock,Consumer Discretionary,145179205
RDFN,Redfin Corporation Common Stock,Finance,979445745
RDI,Reading International Inc Class A Common Stock,Consumer Discretionary,39694346
RDIB,Reading International Inc Class B Common Stock,Consumer Discretionary,148380604
RDNT,RadNet Inc. Common Stock,Health Care,4743633307
RDUS,Radius Recycling Inc. Class A Common Stock,Consumer Discretionary,351660746
RDVT,Red Violet Inc. Common Stock ,Technology,490982811
RDZN,Roadzen Inc. Ordinary Shares,Finance,113269572
RDZNW,Roadzen Inc. Warrants,Finance,5885911
REAL,The RealReal Inc. Common Stock,Consumer Discretionary,1038775626
REBN,Reborn Coffee Inc. Common Stock,Consumer Discretionary,5545572
REFI,Chicago Atlantic Real Estate Finance Inc. Common Stock,Real Estate,298640471
REFR,Research Frontiers Incorporated Common Stock,Miscellaneous,53628459
REG,Regency Centers Corporation Common Stock,Real Estate,13026642271
REGCO,Regency Centers Corporation 5.875% Series B Cumulative Redeemable Preferred Stock,Real Estate,4091131626
REGCP,Regency Centers Corporation 6.25% Series A Cumulative Redeemable Preferred Stock,Real Estate,4337978964
REGN,Regeneron Pharmaceuticals Inc. Common Stock,Health Care,74262246154
REKR,Rekor Systems Inc. Common Stock,Telecommunications,176391609
RELI,Reliance Global Group Inc. Common Stock,Finance,3767661
RELIW,Reliance Global Group Inc. Series A Warrants,Finance,43328
RELL,Richardson Electronics Ltd. Common Stock,Technology,189040937
RELY,Remitly Global Inc. Common Stock,Consumer Discretionary,4559367926
RENB,Renovaro Inc. Common Stock,Health Care,141353665
RENE,Cartesian Growth Corporation II Class A Ordinary Shares,Finance,0
RENEU,Cartesian Growth Corporation II Unit,Finance,0
RENEW,Cartesian Growth Corporation II Warrant,Finance,0
RENT,Rent the Runway Inc. Class A Common Stock,Consumer Discretionary,32998828
REPL,Replimune Group Inc. Common Stock,Health Care,929793064
REVB,Revelation Biosciences Inc. Common Stock,Health Care,1054227
REVBW,Revelation Biosciences Inc. Warrant,Health Care,55802
REYN,Reynolds Consumer Products Inc. Common Stock,Consumer Discretionary,5779013818
RFIL,RF Industries Ltd. Common Stock,Technology,46290052
RGCO,RGC Resources Inc. Common Stock,Utilities,213884900
RGEN,Repligen Corporation Common Stock,Health Care,9294273410
RGLD,Royal Gold Inc. Common Stock,Industrials,9169133072
RGLS,Regulus Therapeutics Inc. Common Stock,Health Care,81220166
RGNX,REGENXBIO Inc. Common Stock,Health Care,390415159
RGP,Resources Connection Inc. Common Stock,Consumer Discretionary,285245342
RGS,Regis Corporation Common Stock,Consumer Discretionary,56512100
RGTI,Rigetti Computing Inc. Common Stock,Technology,2538304679
RGTIW,Rigetti Computing Inc. Warrants,Technology,1036474411
RICK,RCI Hospitality Holdings Inc. Common Stock,Consumer Discretionary,508457000
RIGL,Rigel Pharmaceuticals Inc. Common Stock,Health Care,390525437
RILY,B. Riley Financial Inc. Common Stock,Finance,142434678
RILYG,B. Riley Financial Inc. 5.00% Senior Notes due 2026,Finance,362949179
RILYK,B. Riley Financial Inc. 5.50% Senior Notes Due 2026,Finance,646903537
RILYL,B. Riley Financial Inc. Depositary Shares each representing 1/1000th in a share of 7.375% Series B Cumulative Perpetual Preferred Stock par value $0.0001,Finance,163174631
RILYM,B. Riley Financial Inc. 6.375% Senior Notes due 2025,Finance,760668279
RILYN,B. Riley Financial Inc. 6.50% Senior Notes Due 2026,Finance,371184160
RILYP,B. Riley Financial Inc. Depositary Shares each representing a 1/1000th fractional interest in a share of Series A Cumulative Perpetual Preferred Stock,Finance,160124638
RILYT,B. Riley Financial Inc. 6.00% Senior Notes Due 2028,Finance,307439304
RILYZ,B. Riley Financial Inc. 5.25% Senior Notes due 2028,Finance,272974382
RIME,Algorhythm Holdings Inc. Common Stock,Consumer Staples,537334
RIOT,Riot Platforms Inc. Common Stock ,Finance,4499687744
RIVN,Rivian Automotive Inc. Class A Common Stock,Consumer Discretionary,13033961838
RKDA,Arcadia Biosciences Inc. Common Stock,Consumer Staples,6988356
RKLB,Rocket Lab USA Inc. Common Stock,Industrials,15177300328
RLAY,Relay Therapeutics Inc. Common Stock,Health Care,811807346
RLMD,Relmada Therapeutics Inc. Common Stock,Health Care,11743799
RLYB,Rallybio Corporation Common Stock,Health Care,36509076
RMBI,Richmond Mutual Bancorporation Inc. Common Stock,Finance,149774941
RMBL,RumbleOn Inc. Class B Common Stock,Technology,169426870
RMBS,Rambus Inc. Common Stock,Technology,6711055268
RMCF,Rocky Mountain Chocolate Factory Inc. Common Stock,Consumer Staples,15451477
RMCO,Royalty Management Holding Corporation Class A Common Stock,Miscellaneous,15978222
RMCOW,Royalty Management Holding Corporation Warrant,Miscellaneous,431561
RMNI,Rimini Street Inc. (DE) Common Stock,Consumer Discretionary,271850800
RMR,The RMR Group Inc. Class A Common Stock,Consumer Discretionary,619396939
RMSG,Real Messenger Corporation Ordinary Shares,Technology,19667939
RMSGW,Real Messenger Corporation Warrants,Technology,481911
RMTI,Rockwell Medical Inc. Common Stock,Health Care,71101373
RNA,Avidity Biosciences Inc. Common Stock,Health Care,3539907435
RNAC,Cartesian Therapeutics Inc. Common Stock,Health Care,487966042
RNAZ,TransCode Therapeutics Inc. Common Stock,Health Care,4901480
RNTX,Rein Therapeutics Inc. Common Stock,Health Care,47665070
RNXT,RenovoRx Inc. Common Stock,Health Care,33121848
ROAD,Construction Partners Inc. Class A Common Stock,Industrials,4719396758
ROCK,Gibraltar Industries Inc. Common Stock,Industrials,1890858661
ROIC,Retail Opportunity Investments Corp. Common Stock (MD),Real Estate,2243636293
ROKU,Roku Inc. Class A Common Stock,Telecommunications,11803245163
ROOT,Root Inc. Class A Common Stock,Finance,1258132000
ROP,Roper Technologies Inc. Common Stock,Industrials,56978353967
ROST,Ross Stores Inc. Common Stock,Consumer Discretionary,49251830528
RPAY,Repay Holdings Corporation Class A Common Stock,Consumer Discretionary,685607936
RPD,Rapid7 Inc. Common Stock,Technology,2458736818
RPID,Rapid Micro Biosystems Inc. Class A Common Stock,Industrials,58311369
RPRX,Royalty Pharma plc Class A Ordinary Shares ,Health Care,18300017240
RR,Richtech Robotics Inc. Class B Common Stock,Industrials,370892928
RRBI,Red River Bancshares Inc. Common Stock,Consumer Discretionary,369634398
